name,country,ranking,qs_subject_ranking,subject,tuition,living_cost,image_url,website,requirements_cgpa,ielts,toefl,gre_required,scholarships,course_duration,description,acceptance_rate
Monash University,Australia,42,26,Computer Science|Engineering|Medicine|Business|Law|Economics|Arts|Social Science|Data Science|Architecture|Environmental|Education|Pharmacy|Nursing,36000,18000,https://logo.clearbit.com/monash.edu,https://www.monash.edu,7.5,6.5,100,False,Monash International Merit Scholarship,2,"Monash University is a leading Australian research university and member of the Group of Eight, with campuses in Australia, Malaysia, and South Africa. It is known for its innovations in medicine, engineering, and pharmacy.",0.51
University of Queensland,Australia,43,27,Computer Science|Engineering|Medicine|Business|Law|Economics|Arts|Social Science|Data Science|Environmental|Agriculture|Veterinary|Pharmacy|Education,36000,16000,https://logo.clearbit.com/uq.edu.au,https://www.uq.edu.au,7.0,6.5,92,False,UQ International Scholarship,2,"The University of Queensland is a member of the Group of Eight and one of Australia's most prestigious research institutions. It excels in environmental science, medicine, and business in Brisbane's subtropical setting.",0.51
University of Adelaide,Australia,89,52,Engineering|Computer Science|Medicine|Business|Economics|Arts|Social Science|Data Science|Environmental|Agriculture|Law|Education|Dentistry,36000,14000,https://logo.clearbit.com/adelaide.edu.au,https://www.adelaide.edu.au,7.0,6.5,88,False,Adelaide Scholarship International,2,"The University of Adelaide is one of Australia's oldest and most prestigious universities, a member of the Group of Eight. It is known for its research into sustainable agriculture, engineering, and health sciences.",0.54
University of Western Australia,Australia,72,43,Engineering|Computer Science|Medicine|Business|Economics|Arts|Social Science|Data Science|Environmental|Agriculture|Law|Education|Dentistry,36000,16000,https://logo.clearbit.com/uwa.edu.au,https://www.uwa.edu.au,7.0,6.5,88,False,UWA International Scholarship,2,"The University of Western Australia is a member of the Group of Eight and Perth's leading research university. It is known for its stunning campus on the Swan River and excellence in mining, engineering, and the sciences.",0.52
Macquarie University,Australia,195,87,Computer Science|Engineering|Business|Economics|Arts|Social Science|Data Science|Environmental|Law|Education|Finance|Media|Actuarial Studies,32000,20000,https://logo.clearbit.com/mq.edu.au,https://www.mq.edu.au,7.0,6.5,88,False,Macquarie Vice-Chancellor's International Scholarship,2,"Macquarie University in Sydney is a dynamic research university known for its innovative programmes in business, linguistics, and cognitive science. It has a strong focus on professional development and industry engagement.",0.6
University of Technology Sydney,Australia,148,71,Computer Science|Engineering|Business|Economics|Design|Data Science|Law|Education|Finance|Architecture|Health Sciences|Nursing,34000,20000,https://logo.clearbit.com/uts.edu.au,https://www.uts.edu.au,7.0,6.5,88,False,UTS President's Scholarship,2,"UTS is one of Australia's leading universities of technology, known for its industry-facing curriculum and state-of-the-art city campus. It excels in engineering, design, and business.",0.6
RMIT University,Australia,224,97,Engineering|Computer Science|Business|Design|Architecture|Arts|Data Science|Social Science|Education|Environmental|Health Sciences,32000,20000,https://logo.clearbit.com/rmit.edu.au,https://www.rmit.edu.au,7.0,6.5,88,False,,2,"RMIT University in Melbourne is a global university of technology, design, and enterprise, known for its strong focus on applied learning and industry connections. It is the largest university in Australia by enrolment.",0.7
Curtin University,Australia,218,94,Engineering|Computer Science|Business|Economics|Arts|Social Science|Data Science|Environmental|Law|Education|Architecture|Health Sciences|Mining,28000,16000,https://logo.clearbit.com/curtin.edu.au,https://www.curtin.edu.au,7.0,6.5,85,False,Curtin International Scholarship,2,"Curtin University in Perth is Australia's largest university in the west, known for its strengths in engineering, mining, and health sciences. It has strong industry ties to Western Australia's resources sector.",0.7
Technical University of Munich,Germany,37,23,Engineering|Computer Science|Mathematics|Physics|Business|Economics|Data Science|Architecture|Environmental|Bioengineering|Aerospace|Mechanical Engineering,3000,14000,https://logo.clearbit.com/tum.de,https://www.tum.de,7.5,7.0,95,True,TUM Global Incentive Fund,2,TU Munich is Germany's top technical university and consistently one of Europe's leading research institutions. It has strong connections with global industry and is a hub for technology and innovation in the Munich region.,0.1
LMU Munich,Germany,54,31,Medicine|Computer Science|Physics|Economics|Law|Arts|Social Science|Mathematics|Environmental|Philosophy|Data Science|Business,3000,14000,https://logo.clearbit.com/lmu.de,https://www.lmu.de,7.5,7.0,95,False,LMU International Scholarship,2,"LMU Munich is one of Europe's most prestigious universities, with strengths in medicine, natural sciences, and the humanities. It is a gateway to Germany's vibrant research and innovation ecosystem.",0.2
Heidelberg University,Germany,47,29,Medicine|Computer Science|Physics|Economics|Law|Arts|Social Science|Mathematics|Environmental|Philosophy|Data Science|Chemistry|Biology,3000,12000,https://logo.clearbit.com/uni-heidelberg.de,https://www.uni-heidelberg.de,7.5,7.0,95,False,Heidelberg University Scholarship,2,"Heidelberg University, founded in 1386, is Germany's oldest university and one of Europe's most storied academic institutions. It has produced numerous Nobel laureates and excels in medicine, natural sciences, and the humanities.",0.25
Humboldt University Berlin,Germany,120,68,Arts|Social Science|Economics|Law|Medicine|Computer Science|Mathematics|Physics|History|Philosophy|Education|Environmental,3000,15000,https://logo.clearbit.com/hu-berlin.de,https://www.hu-berlin.de,7.0,7.0,95,False,Humboldt Foundation Scholarship,2,"Humboldt University Berlin is one of Germany's most important research universities, with a 200-year history of pioneering academic excellence. It is known for its contributions to philosophy, economics, and the natural sciences.",0.3
Free University Berlin,Germany,98,57,Arts|Social Science|Economics|Law|Medicine|Computer Science|Mathematics|Physics|History|Philosophy|Environmental|Political Science,3000,15000,https://logo.clearbit.com/fu-berlin.de,https://www.fu-berlin.de,7.0,7.0,95,False,Dahlem Research School Scholarship,2,"The Free University of Berlin is a leading German research university known for its excellence in the humanities, social sciences, and natural sciences. It has a vibrant, cosmopolitan campus community in western Berlin.",0.3
RWTH Aachen University,Germany,106,62,Engineering|Computer Science|Mathematics|Physics|Business|Economics|Data Science|Architecture|Environmental|Mechanical Engineering|Bioengineering,3000,12000,https://logo.clearbit.com/rwth-aachen.de,https://www.rwth-aachen.de,7.5,7.0,95,True,RWTH Scholarship,2,RWTH Aachen is Germany's largest technical university and one of Europe's most prestigious engineering schools. It has exceptionally strong ties to major German and international industry partners.,0.2
Karlsruhe Institute of Technology,Germany,116,67,Engineering|Computer Science|Mathematics|Physics|Business|Economics|Data Science|Architecture|Environmental|Mechanical Engineering|Electrical Engineering,3000,12000,https://logo.clearbit.com/kit.edu,https://www.kit.edu,7.5,7.0,95,True,KIT Scholarship,2,"KIT (Karlsruhe Institute of Technology) is one of Germany's top research universities and a major centre for engineering, natural sciences, and business. It was created from a merger of the University of Karlsruhe and a national research centre.",0.22
University of Stuttgart,Germany,296,115,Engineering|Computer Science|Mathematics|Physics|Business|Economics|Data Science|Architecture|Environmental|Aerospace|Mechanical Engineering|Automotive Engineering,3000,12000,https://logo.clearbit.com/uni-stuttgart.de,https://www.uni-stuttgart.de,7.0,7.0,90,True,,2,"The University of Stuttgart is a leading technical university in the heart of Baden-Württemberg's high-tech corridor. It is famous for its engineering programmes and close links to companies like Daimler, Bosch, and Porsche.",0.35
University of Hamburg,Germany,176,82,Arts|Social Science|Economics|Law|Medicine|Computer Science|Mathematics|Physics|Environmental|Business|Data Science|Education,3000,14000,https://logo.clearbit.com/uni-hamburg.de,https://www.uni-hamburg.de,7.0,7.0,90,False,,2,"The University of Hamburg is one of Germany's largest and most prestigious universities, with particular strengths in climate research, natural sciences, and the humanities. It is situated in one of Europe's most vibrant port cities.",0.35
University of Cologne,Germany,232,99,Arts|Social Science|Economics|Law|Medicine|Computer Science|Mathematics|Physics|Environmental|Business|Data Science|Education|Philosophy,3000,12000,https://logo.clearbit.com/uni-koeln.de,https://www.uni-koeln.de,7.0,7.0,90,False,,2,"The University of Cologne, founded in 1388, is one of Germany's oldest and largest universities, with a broad range of programmes in the natural and social sciences. Its business school is one of the most prestigious in Germany.",0.35
Technical University of Berlin,Germany,154,74,Engineering|Computer Science|Mathematics|Physics|Business|Economics|Data Science|Architecture|Environmental|Mechanical Engineering|Electrical Engineering,3000,15000,https://logo.clearbit.com/tu-berlin.de,https://www.tu-berlin.de,7.0,7.0,90,True,TU Berlin Scholarship,2,"TU Berlin is one of Germany's most important technical universities, located in the heart of the capital. It has a strong focus on engineering and natural sciences and is closely connected to Berlin's thriving start-up ecosystem.",0.3
University of Freiburg,Germany,165,77,Medicine|Computer Science|Physics|Economics|Law|Arts|Social Science|Mathematics|Environmental|Philosophy|Data Science|Biology|Chemistry,3000,12000,https://logo.clearbit.com/uni-freiburg.de,https://www.uni-freiburg.de,7.0,7.0,90,False,Freiburg University Scholarship,2,"The University of Freiburg is one of Germany's oldest and most distinguished universities, situated in the beautiful Black Forest region. It is known for its excellence in medicine, natural sciences, and the humanities.",0.3
Delft University of Technology,Netherlands,47,29,Engineering|Computer Science|Architecture|Mathematics|Physics|Data Science|Environmental|Aerospace|Mechanical Engineering|Electrical Engineering|Business,18000,14000,https://logo.clearbit.com/tudelft.nl,https://www.tudelft.nl,7.5,7.0,100,False,TU Delft Excellence Scholarship,2,"TU Delft is the Netherlands' leading technical university and one of Europe's best. It is globally recognised for its research in aerospace, hydraulic engineering, and computer science.",0.3
University of Amsterdam,Netherlands,61,35,Computer Science|Business|Economics|Law|Arts|Social Science|Data Science|Environmental|Medicine|Mathematics|Philosophy|Political Science|Finance,18000,14000,https://logo.clearbit.com/uva.nl,https://www.uva.nl,7.5,7.0,100,False,UvA Scholarship,2,"The University of Amsterdam is the Netherlands' largest research university, situated at the cultural heart of one of Europe's most cosmopolitan cities. It excels in social sciences, economics, law, and the humanities.",0.35
Leiden University,Netherlands,128,72,Computer Science|Business|Economics|Law|Arts|Social Science|Data Science|Environmental|Medicine|Mathematics|History|International Relations|Science,18000,14000,https://logo.clearbit.com/universiteitleiden.nl,https://www.universiteitleiden.nl,7.5,7.0,100,False,Leiden University Excellence Scholarship,2,"Leiden University, the Netherlands' oldest university, has a rich 450-year history of groundbreaking research and a Nobel Prize tradition. It is particularly renowned for its law school and social sciences.",0.35
Erasmus University Rotterdam,Netherlands,172,81,Business|Economics|Law|Social Science|Data Science|Environmental|Medicine|Mathematics|Finance|Management|Public Health|International Relations,16000,14000,https://logo.clearbit.com/eur.nl,https://www.eur.nl,7.0,7.0,100,False,Erasmus Trustfonds Scholarship,2,Erasmus University Rotterdam is a world-leading research university named after the great Dutch humanist scholar. It is renowned for its Erasmus School of Economics and Rotterdam School of Management.,0.4
Utrecht University,Netherlands,87,51,Computer Science|Business|Economics|Law|Arts|Social Science|Data Science|Environmental|Medicine|Mathematics|Veterinary|Pharmacy|Education,18000,14000,https://logo.clearbit.com/uu.nl,https://www.uu.nl,7.5,7.0,100,False,Utrecht Excellence Scholarship,2,"Utrecht University is the Netherlands' largest university and a top global research institution with a rich 380-year history. It has particular strengths in life sciences, social sciences, and the humanities.",0.35
Radboud University,Netherlands,200,89,Computer Science|Business|Economics|Law|Arts|Social Science|Data Science|Environmental|Medicine|Mathematics|Philosophy|Theology|Natural Sciences,16000,13000,https://logo.clearbit.com/ru.nl,https://www.ru.nl,7.0,7.0,95,False,Radboud Scholarship Programme,2,"Radboud University in Nijmegen is one of the leading academic communities in the Netherlands, known for its cutting-edge research in the neurosciences, social sciences, and philosophy.",0.4
Eindhoven University of Technology,Netherlands,149,73,Engineering|Computer Science|Mathematics|Physics|Data Science|Architecture|Environmental|Mechanical Engineering|Electrical Engineering|Business|Design,18000,13000,https://logo.clearbit.com/tue.nl,https://www.tue.nl,7.5,7.0,100,True,TU/e Excellence Scholarship,2,"Eindhoven University of Technology (TU/e) is a world-class technical university in the heart of the Brainport Eindhoven region, Europe's top innovation hub. It has close ties to Philips, ASML, and other global tech leaders.",0.28
VU Amsterdam,Netherlands,245,104,Computer Science|Business|Economics|Law|Arts|Social Science|Data Science|Environmental|Medicine|Mathematics|Philosophy|Education|Theology,17000,14000,https://logo.clearbit.com/vu.nl,https://www.vu.nl,7.0,7.0,95,False,VU Fellowship Programme,2,"VU Amsterdam (Vrije Universiteit) is a research university at the heart of Amsterdam, known for its open and diverse community. It has particular strengths in the life sciences, social sciences, and business.",0.45
Sciences Po Paris,France,244,103,Economics|Finance|Business|Law|Social Science|Public Health|Data Science|Political Science|International Relations|Sociology|Management|Arts,18000,16000,https://logo.clearbit.com/sciencespo.fr,https://www.sciencespo.fr,7.5,7.0,100,False,Émile Boutmy Scholarship,2,"Sciences Po Paris is one of France's most prestigious grandes écoles, known worldwide for its excellence in political science, law, international affairs, and economics. It is the breeding ground for France's political elite.",0.25
HEC Paris,France,69,40,Business|Finance|Economics|Management|Data Science|Social Science|Law|Marketing|Entrepreneurship|Strategy,50000,16000,https://logo.clearbit.com/hec.edu,https://www.hec.edu,8.0,7.0,105,True,HEC Foundation Scholarship,2,HEC Paris is Europe's top-ranked business school and a global leader in management education. It produces graduates who lead major corporations and institutions across the world.,0.12
Sorbonne University,France,59,34,Arts|Social Science|Economics|Law|Medicine|Computer Science|Mathematics|Physics|History|Philosophy|Environmental|Literature|Linguistics,6000,16000,https://logo.clearbit.com/sorbonne-universite.fr,https://www.sorbonne-universite.fr,7.0,7.0,95,False,Sorbonne Scholarship,2,"Sorbonne University is one of the world's oldest and most prestigious institutions, with a legacy of academic excellence dating back to 1257. It is a leading European research university renowned for the sciences, humanities, and medicine.",0.3
Paris-Saclay University,France,15,10,Engineering|Computer Science|Mathematics|Physics|Business|Economics|Data Science|Environmental|Chemistry|Biology|Medicine,4000,14000,https://logo.clearbit.com/universite-paris-saclay.fr,https://www.universite-paris-saclay.fr,7.5,7.0,100,False,Paris-Saclay International Master's Scholarship,2,"Paris-Saclay University is a world-class research university located south of Paris, formed from a merger of some of France's most prestigious grandes écoles. It ranks among the world's top 15 in the natural sciences.",0.3
Ecole Polytechnique,France,42,26,Engineering|Computer Science|Mathematics|Physics|Data Science|Environmental|Economics|Architecture|Aerospace|Applied Mathematics,16000,16000,https://logo.clearbit.com/polytechnique.edu,https://www.polytechnique.edu,8.0,7.0,100,True,Polytechnique International Scholarship,2,"École Polytechnique (X) is France's most elite grande école, known for its rigorous scientific education and producing some of the world's most influential engineers and scientists. It has a long military tradition and close ties to the French state.",0.08
University of Paris,France,262,107,Arts|Social Science|Economics|Law|Medicine|Computer Science|Mathematics|Physics|Environmental|Philosophy|Education|Neuroscience,4000,16000,https://logo.clearbit.com/u-paris.fr,https://www.u-paris.fr,7.0,7.0,95,False,,2,"Université Paris Cité is a leading French research university situated at the heart of Paris, formed from the merger of Paris Descartes and Paris Diderot. It excels in medicine, health sciences, and social sciences.",0.35
Grenoble Alpes University,France,351,130,Engineering|Computer Science|Mathematics|Physics|Business|Economics|Data Science|Environmental|Social Science|Arts|Architecture,4000,12000,https://logo.clearbit.com/univ-grenoble-alpes.fr,https://www.univ-grenoble-alpes.fr,7.0,6.5,90,False,Grenoble Excellence Scholarship,2,"Grenoble Alpes University is a leading French research university, particularly strong in engineering and the natural sciences. Its location in the Alps makes it a centre for environmental research and innovation.",0.4
CentraleSupélec,France,333,122,Engineering|Computer Science|Mathematics|Physics|Data Science|Environmental|Business|Economics|Electrical Engineering|Mechanical Engineering,15000,15000,https://logo.clearbit.com/centralesupelec.fr,https://www.centralesupelec.fr,8.0,7.0,100,True,CS International Scholarship,2,"CentraleSupélec is one of France's most prestigious engineering grandes écoles, produced from the merger of Centrale Paris and Supélec. It is renowned for producing highly versatile engineers with strong mathematical and scientific foundations.",0.15
Trinity College Dublin,Ireland,87,51,Computer Science|Engineering|Business|Economics|Law|Arts|Social Science|Data Science|Environmental|Medicine|Philosophy|Mathematics|Finance,25000,15000,https://logo.clearbit.com/tcd.ie,https://www.tcd.ie,7.5,6.5,100,False,TCD Ussher Scholarship,1,"Trinity College Dublin is Ireland's oldest and most prestigious university, founded in 1592. It combines centuries of tradition with cutting-edge research, and is known for its exceptional arts, humanities, and science programmes.",0.3
University College Dublin,Ireland,181,83,Computer Science|Engineering|Business|Economics|Law|Arts|Social Science|Data Science|Environmental|Medicine|Agriculture|Architecture|Finance|Education,22000,15000,https://logo.clearbit.com/ucd.ie,https://www.ucd.ie,7.0,6.5,88,False,UCD Global Scholarship,1,"University College Dublin is Ireland's largest and most internationally engaged university, a member of the prestigious Russell Group equivalent. It is known for its strengths in business, engineering, and the life sciences.",0.42
University of Galway,Ireland,250,106,Computer Science|Engineering|Business|Economics|Law|Arts|Social Science|Data Science|Environmental|Medicine|Marine Science|Education,20000,14000,https://logo.clearbit.com/universityofgalway.ie,https://www.universityofgalway.ie,7.0,6.5,88,False,Galway International Excellence Scholarship,1,"University of Galway (formerly NUI Galway) is a research-led university on Ireland's Wild Atlantic Way, renowned for its Celtic studies, marine research, and biomedical engineering programmes.",0.5
University College Cork,Ireland,303,118,Computer Science|Engineering|Business|Economics|Law|Arts|Social Science|Data Science|Environmental|Medicine|Food Science|Education|Pharmacy,20000,14000,https://logo.clearbit.com/ucc.ie,https://www.ucc.ie,7.0,6.5,88,False,,1,"University College Cork is a leading Irish research university known for its strengths in food science, environmental research, and the humanities. It is set in the charming city of Cork.",0.52
University of Limerick,Ireland,601,180,Engineering|Computer Science|Business|Economics|Arts|Social Science|Data Science|Environmental|Education|Law|Health Sciences|Music,18000,14000,https://logo.clearbit.com/ul.ie,https://www.ul.ie,7.0,6.5,85,False,UL Scholarship,1,"The University of Limerick is a dynamic, industry-focused university renowned for its innovative programmes and strong cooperative education system. It has become a significant centre for technology and medical devices companies in Ireland.",0.6
ETH Zurich,Switzerland,7,5,Engineering|Computer Science|Mathematics|Physics|Data Science|Environmental|Architecture|Chemistry|Biology|Bioengineering|Aerospace|Economics,1600,22000,https://logo.clearbit.com/ethz.ch,https://www.ethz.ch,8.0,7.0,100,True,ETH Excellence Scholarship,2,"ETH Zurich is Europe's leading science and technology university and consistently one of the world's top 10 institutions. It has produced 22 Nobel laureates and is known for its exceptional research in science, technology, engineering, and mathematics.",0.1
EPFL,Switzerland,17,11,Engineering|Computer Science|Mathematics|Physics|Data Science|Environmental|Architecture|Chemistry|Biology|Bioengineering|Electrical Engineering,1600,22000,https://logo.clearbit.com/epfl.ch,https://www.epfl.ch,8.0,7.0,100,True,EPFL Excellence Fellowship,2,"EPFL (École Polytechnique Fédérale de Lausanne) is a world-class technical university on the shores of Lake Geneva. It is among Europe's top universities for engineering, computer science, and the natural sciences.",0.17
University of Zurich,Switzerland,86,51,Medicine|Computer Science|Economics|Law|Arts|Social Science|Mathematics|Environmental|Philosophy|Data Science|Business|Veterinary,2000,22000,https://logo.clearbit.com/uzh.ch,https://www.uzh.ch,7.5,7.0,100,False,UZH Fellowship,2,"The University of Zurich is Switzerland's largest university and a leading European research institution. It is particularly strong in medicine, natural sciences, and the social sciences.",0.25
University of Geneva,Switzerland,111,64,Economics|Law|Arts|Social Science|Medicine|Computer Science|Mathematics|Environmental|Philosophy|International Relations|Data Science|Business,2000,22000,https://logo.clearbit.com/unige.ch,https://www.unige.ch,7.5,7.0,100,False,University of Geneva Excellence Master Grant,2,"The University of Geneva is Switzerland's second-largest university, situated at the centre of international diplomacy near the UN headquarters. It excels in international law, economics, and the sciences.",0.3
University of Basel,Switzerland,149,73,Medicine|Computer Science|Economics|Law|Arts|Social Science|Mathematics|Environmental|Philosophy|Data Science|Chemistry|Biology|Pharmacy,2000,20000,https://logo.clearbit.com/unibas.ch,https://www.unibas.ch,7.5,7.0,100,False,Basel Excellence Scholarship,2,"The University of Basel is Switzerland's oldest university, founded in 1460, and a leading institution in the natural sciences, medicine, and the humanities. Its historic setting in one of Europe's great cultural cities makes it a unique place to study.",0.35
National University of Singapore,Singapore,8,6,Computer Science|Engineering|Business|Economics|Law|Medicine|Architecture|Arts|Social Science|Data Science|Environmental|Design|Dentistry|Pharmacy|Finance,24000,14000,https://logo.clearbit.com/nus.edu.sg,https://www.nus.edu.sg,8.0,7.0,100,True,NUS Research Scholarship,1,"NUS is Asia's top-ranked university and consistently one of the world's best, known for its exceptional research and education across engineering, business, law, and medicine. It is at the heart of Singapore's knowledge-based economy.",0.17
Nanyang Technological University,Singapore,26,17,Engineering|Computer Science|Business|Economics|Data Science|Environmental|Mathematics|Physics|Social Science|Arts|Education|Finance|Bioengineering,24000,14000,https://logo.clearbit.com/ntu.edu.sg,https://www.ntu.edu.sg,8.0,7.0,100,True,NTU Research Scholarship,1,"NTU is one of Asia's leading research-intensive universities and consistently ranked in the global top 30. It is particularly known for engineering, computer science, and business education in a futuristic campus setting.",0.22
Singapore Management University,Singapore,511,165,Business|Economics|Finance|Law|Data Science|Social Science|Management|Accountancy|Marketing|Information Systems,30000,14000,https://logo.clearbit.com/smu.edu.sg,https://www.smu.edu.sg,7.5,7.0,100,False,SMU Master's Scholarship,1,"Singapore Management University is Singapore's premier business and management university, modelled after the Wharton School. It is known for its practical, real-world focused education and strong industry partnerships.",0.25
