name,country,ranking,qs_subject_ranking,subject,tuition,living_cost,image_url,website,requirements_cgpa,ielts,toefl,gre_required,scholarships,course_duration,description,acceptance_rate
Northwestern University,United States,46,28,Computer Science|Engineering|Business|Medicine|Law|Economics|Social Science|Arts|Data Science|Journalism|Education|Finance|Mathematics,62000,22000,https://logo.clearbit.com/northwestern.edu,https://www.northwestern.edu,8.5,7.0,100,True,Northwestern Graduate Fellowship,2,"Northwestern University is a leading private research university in Evanston, Illinois, known for its strengths in business, journalism, engineering, and the performing arts.",0.07
Dartmouth College,United States,240,102,Economics|Business|Arts|History|Philosophy|Social Science|Engineering|Computer Science|Environmental|Law|Medicine|Data Science,62000,22000,https://logo.clearbit.com/dartmouth.edu,https://www.dartmouth.edu,8.5,7.0,100,False,Dartmouth Fellowship,2,"Dartmouth College is an Ivy League institution known for its emphasis on undergraduate education and a tight-knit community. It excels in business (Tuck School), engineering, and the liberal arts.",0.07
Brown University,United States,198,88,Computer Science|Engineering|Economics|Arts|History|Philosophy|Social Science|Medicine|Data Science|Environmental|Mathematics|Business,65000,22000,https://logo.clearbit.com/brown.edu,https://www.brown.edu,8.5,7.0,100,False,Brown Graduate Fellowship,2,"Brown University is an Ivy League research university in Providence, Rhode Island, known for its open curriculum and emphasis on student autonomy. It excels in computer science, engineering, and the liberal arts.",0.05
Rice University,United States,165,75,Computer Science|Engineering|Physics|Mathematics|Economics|Arts|Architecture|Social Science|Data Science|Business|Bioengineering,55000,20000,https://logo.clearbit.com/rice.edu,https://www.rice.edu,8.5,7.0,100,True,Rice Graduate Fellowship,2,"Rice University is a small, highly selective research university in Houston, Texas, known for its strong programmes in engineering, natural sciences, and architecture. Its low student-to-faculty ratio ensures an exceptional learning experience.",0.09
Vanderbilt University,United States,186,86,Computer Science|Engineering|Business|Medicine|Law|Economics|Education|Arts|Social Science|Data Science|Nursing|Mathematics,61000,20000,https://logo.clearbit.com/vanderbilt.edu,https://www.vanderbilt.edu,8.0,7.0,100,True,Vanderbilt Graduate Fellowship,2,"Vanderbilt University is a leading private research university in Nashville, Tennessee, known for its excellence in medicine, education, and the arts. It combines a friendly, collaborative community with rigorous academic standards.",0.09
University of Notre Dame,United States,216,93,Computer Science|Engineering|Business|Law|Economics|Arts|History|Philosophy|Social Science|Data Science|Theology|Finance,60000,20000,https://logo.clearbit.com/nd.edu,https://www.nd.edu,8.0,7.0,100,False,Notre Dame Graduate Fellowship,2,"The University of Notre Dame is a leading Catholic research university in South Bend, Indiana, renowned for its law school, business school, and strong sense of community and tradition.",0.13
Georgetown University,United States,264,108,Computer Science|Business|Law|Economics|Social Science|International Relations|Arts|History|Medicine|Data Science|Public Policy|Finance,60000,22000,https://logo.clearbit.com/georgetown.edu,https://www.georgetown.edu,8.0,7.0,100,False,Georgetown Graduate Fellowship,2,"Georgetown University is a leading Jesuit research university in Washington D.C., known for its programmes in law, international relations, business, and public policy. Its location makes it a hub for politics and government.",0.12
Emory University,United States,278,112,Business|Medicine|Law|Economics|Computer Science|Social Science|Arts|Public Health|Data Science|Environmental|Finance|Nursing,58000,20000,https://logo.clearbit.com/emory.edu,https://www.emory.edu,8.0,7.0,100,False,Emory Graduate Fellowship,2,"Emory University is a top research university in Atlanta, Georgia, known for its outstanding programmes in medicine, public health, business, and the arts. It has strong connections with the Centers for Disease Control and Prevention.",0.17
Carnegie Mellon University,United States,53,30,Computer Science|Engineering|Business|Arts|Social Science|Data Science|Architecture|Mathematics|Robotics|Design|Public Policy|Economics,62000,22000,https://logo.clearbit.com/cmu.edu,https://www.cmu.edu,8.5,7.0,100,True,CMU Graduate Fellowship,2,"Carnegie Mellon University is a world-leading research university in Pittsburgh, Pennsylvania, consistently ranked among the top institutions globally for computer science, engineering, and the arts. It is a hub for technology and innovation.",0.15
University of Michigan,United States,23,16,Computer Science|Engineering|Business|Medicine|Law|Economics|Education|Arts|Social Science|Data Science|Architecture|Environmental|Public Policy|Finance,52000,20000,https://logo.clearbit.com/umich.edu,https://www.umich.edu,8.0,6.5,100,True,Rackham Graduate School Fellowship,2,"The University of Michigan is one of the world's top public universities, renowned for its research output and comprehensive range of programmes. Its Ross School of Business and College of Engineering are among the best in the United States.",0.2
University of North Carolina Chapel Hill,United States,64,37,Business|Medicine|Law|Economics|Computer Science|Social Science|Arts|Public Health|Data Science|Environmental|Education|Pharmacy|Nursing,35000,18000,https://logo.clearbit.com/unc.edu,https://www.unc.edu,8.0,6.5,100,False,UNC Graduate School Fellowship,2,"UNC Chapel Hill is one of the oldest public universities in the United States, known for its excellence in medicine, public health, and the social sciences. It is a flagship institution of North Carolina's renowned Research Triangle.",0.18
University of California Los Angeles,United States,44,27,Computer Science|Engineering|Business|Medicine|Law|Economics|Arts|Social Science|Data Science|Architecture|Environmental|Film|Public Health|Finance|Mathematics,44000,22000,https://logo.clearbit.com/ucla.edu,https://www.ucla.edu,8.0,7.0,100,True,UCLA Graduate Division Fellowship,2,"UCLA is one of the world's top public research universities, located in the vibrant Westside of Los Angeles. It excels in medicine, engineering, law, and the arts, and has produced more Olympic athletes than any other university.",0.12
University of California Berkeley,United States,10,6,Computer Science|Engineering|Business|Economics|Law|Arts|Social Science|Data Science|Architecture|Environmental|Physics|Mathematics|Chemistry|Public Policy,45000,22000,https://logo.clearbit.com/berkeley.edu,https://www.berkeley.edu,8.5,7.0,100,True,Berkeley Fellowship,2,"UC Berkeley is the world's leading public research university, renowned for its Nobel laureates, pioneering research, and innovative spirit. It excels across virtually every academic discipline and is a driving force in technology and public policy.",0.14
University of Illinois Urbana-Champaign,United States,35,22,Computer Science|Engineering|Business|Economics|Law|Arts|Social Science|Data Science|Architecture|Environmental|Physics|Mathematics|Agriculture|Education,36000,18000,https://logo.clearbit.com/illinois.edu,https://www.illinois.edu,8.0,6.5,103,True,Illinois Graduate College Fellowship,2,"UIUC is one of the world's top research universities, renowned for its engineering and computer science programmes. It is a major hub for technology innovation and has produced an extraordinary number of Fortune 500 CEOs.",0.45
Georgia Institute of Technology,United States,97,56,Computer Science|Engineering|Business|Economics|Architecture|Data Science|Mathematics|Physics|Environmental|Design|Public Policy|Computing,32000,18000,https://logo.clearbit.com/gatech.edu,https://www.gatech.edu,8.0,6.5,100,True,Georgia Tech Graduate Fellowship,2,"Georgia Tech is a world-class technology and engineering university in Atlanta, consistently ranked among the top public universities in the United States. It has strong industry partnerships and an outstanding innovation ecosystem.",0.18
University of Texas at Austin,United States,71,42,Computer Science|Engineering|Business|Law|Economics|Arts|Social Science|Data Science|Architecture|Environmental|Public Policy|Education|Finance,38000,18000,https://logo.clearbit.com/utexas.edu,https://www.utexas.edu,7.5,6.5,100,True,UT Austin Graduate School Fellowship,2,"UT Austin is one of the largest and most prestigious public universities in the United States, known for its research excellence in engineering, business, and law. It sits at the heart of Austin's thriving tech and startup ecosystem.",0.31
Purdue University,United States,106,62,Engineering|Computer Science|Agriculture|Business|Economics|Arts|Social Science|Data Science|Mathematics|Physics|Pharmacy|Education,30000,16000,https://logo.clearbit.com/purdue.edu,https://www.purdue.edu,7.5,6.5,88,True,Purdue Graduate School Fellowship,2,"Purdue University is a leading public research university in West Lafayette, Indiana, renowned for its engineering, agriculture, and business programmes. It has a strong tradition of astronaut graduates and aerospace research.",0.58
Ohio State University,United States,171,80,Engineering|Computer Science|Business|Medicine|Law|Economics|Arts|Social Science|Data Science|Architecture|Education|Agriculture|Public Health|Finance,35000,17000,https://logo.clearbit.com/osu.edu,https://www.osu.edu,7.5,6.5,88,False,OSU Graduate Scholarship,2,"Ohio State University is one of the largest and most comprehensive public universities in the United States. It excels in business, medicine, engineering, and the social sciences, with top-ranked programmes across many disciplines.",0.54
University of Minnesota,United States,185,85,Engineering|Computer Science|Business|Medicine|Law|Economics|Arts|Social Science|Data Science|Architecture|Education|Agriculture|Public Health|Environmental,34000,17000,https://logo.clearbit.com/umn.edu,https://www.umn.edu,7.5,6.5,88,False,UMN Graduate School Fellowship,2,"The University of Minnesota is a major research university with strengths in engineering, medicine, and the natural sciences. It is classified as a very high research activity university and is known for its innovations in agriculture and medicine.",0.54
University of Wisconsin-Madison,United States,100,58,Engineering|Computer Science|Business|Medicine|Law|Economics|Arts|Social Science|Data Science|Architecture|Agriculture|Environmental|Education|Public Health,36000,17000,https://logo.clearbit.com/wisc.edu,https://www.wisc.edu,7.5,6.5,92,False,UW-Madison Graduate Fellowship,2,"The University of Wisconsin-Madison is a world-class public research university known for the Wisconsin Idea — the principle that education should improve people's lives beyond the classroom. It excels in biological sciences, engineering, and the social sciences.",0.57
University of Florida,United States,170,78,Engineering|Computer Science|Business|Medicine|Law|Economics|Arts|Social Science|Data Science|Architecture|Agriculture|Environmental|Education|Pharmacy,30000,16000,https://logo.clearbit.com/ufl.edu,https://www.ufl.edu,7.5,6.5,88,False,UF Graduate School Scholarship,2,"The University of Florida is a leading public research university and the flagship institution of Florida's state university system. It is known for its strengths in agriculture, engineering, and health sciences.",0.31
University of Southern California,United States,113,66,Computer Science|Engineering|Business|Law|Cinema|Arts|Social Science|Data Science|Architecture|Environmental|Education|Public Policy|Economics|Communication,66000,22000,https://logo.clearbit.com/usc.edu,https://www.usc.edu,8.0,6.5,100,True,USC Graduate Scholarship,2,"The University of Southern California is a leading private research university in Los Angeles, known for its strengths in film, business, engineering, and the arts. Its location in Hollywood makes it the top choice for aspiring filmmakers.",0.16
New York University,United States,39,25,Computer Science|Business|Law|Arts|Social Science|Data Science|Economics|Finance|Education|Public Health|Architecture|Environmental|Nursing|Medicine,58000,22000,https://logo.clearbit.com/nyu.edu,https://www.nyu.edu,8.0,7.0,100,False,NYU Graduate Fellowship,2,"New York University is a leading private research university in the heart of New York City, known for its strengths in business, law, and the arts. Its urban setting provides unparalleled access to internships, cultural events, and professional networks.",0.16
Boston University,United States,113,66,Computer Science|Engineering|Business|Law|Arts|Social Science|Data Science|Economics|Finance|Education|Public Health|Architecture|Medicine|Communications,62000,22000,https://logo.clearbit.com/bu.edu,https://www.bu.edu,7.5,6.5,100,True,BU Dean's Fellowship,2,"Boston University is a large, comprehensive research university in the heart of Boston, with strengths in engineering, medicine, business, and communications. Its location in Boston's academic hub provides excellent networking and career opportunities.",0.57
Northeastern University,United States,344,128,Computer Science|Engineering|Business|Law|Arts|Social Science|Data Science|Economics|Finance|Health Sciences|Architecture|Design|Public Health,58000,22000,https://logo.clearbit.com/northeastern.edu,https://www.northeastern.edu,7.5,6.5,100,False,Northeastern Merit Scholarship,2,"Northeastern University in Boston is renowned for its cooperative education programme, which integrates classroom study with professional work experience. It is a top destination for students in computer science, engineering, and business.",0.2
Tufts University,United States,278,112,Computer Science|Engineering|Business|Law|Arts|Social Science|Data Science|Economics|International Relations|Medicine|Architecture|Environmental|Education,67000,22000,https://logo.clearbit.com/tufts.edu,https://www.tufts.edu,8.0,7.0,100,False,Tufts Graduate School Scholarship,2,"Tufts University is a top research university near Boston, known for its strengths in international relations, engineering, veterinary medicine, and the liberal arts. It has a strong focus on civic engagement and global citizenship.",0.11
Case Western Reserve University,United States,306,118,Engineering|Computer Science|Medicine|Law|Business|Economics|Arts|Social Science|Data Science|Nursing|Dentistry|Environmental|Mathematics,55000,20000,https://logo.clearbit.com/case.edu,https://www.case.edu,8.0,6.5,100,True,CWRU Provost Fellowship,2,"Case Western Reserve University in Cleveland, Ohio, is a leading private research university with particular strengths in medicine, engineering, and law. It has one of the highest funded research budgets among private US universities.",0.3
Washington University in St. Louis,United States,55,32,Computer Science|Engineering|Business|Medicine|Law|Economics|Arts|Social Science|Data Science|Architecture|Environmental|Education|Biomedical Engineering|Finance,62000,20000,https://logo.clearbit.com/wustl.edu,https://www.wustl.edu,8.5,7.0,100,False,WashU Graduate Fellowship,2,"Washington University in St. Louis is a leading private research university known for its strength in medicine, business, engineering, and the arts. It consistently ranks among the top 15 universities in the United States.",0.13
University of Washington,United States,85,50,Computer Science|Engineering|Medicine|Business|Law|Economics|Arts|Social Science|Data Science|Environmental|Public Health|Education|Architecture|Nursing,37000,20000,https://logo.clearbit.com/washington.edu,https://www.washington.edu,7.5,6.5,92,True,UW Graduate School Fellowship,2,"The University of Washington is a world-class public research university in Seattle, renowned for its computer science and engineering programmes. Its location in the Pacific Northwest puts it at the centre of the global tech industry.",0.52
University of California San Diego,United States,62,36,Computer Science|Engineering|Medicine|Business|Economics|Arts|Social Science|Data Science|Environmental|Mathematics|Physics|Bioengineering|Public Health,44000,22000,https://logo.clearbit.com/ucsd.edu,https://www.ucsd.edu,8.0,7.0,100,True,UCSD Graduate Fellowship,2,"UC San Diego is a world-class research university in La Jolla, California, renowned for its strengths in science, engineering, and medicine. It is ranked among the top 20 public universities globally.",0.3
University of California Davis,United States,149,72,Engineering|Computer Science|Medicine|Business|Economics|Arts|Social Science|Data Science|Environmental|Agriculture|Veterinary|Law|Education,33000,18000,https://logo.clearbit.com/ucdavis.edu,https://www.ucdavis.edu,7.5,6.5,88,False,UC Davis Graduate Fellowship,2,"UC Davis is a leading public research university in the Sacramento Valley, renowned for its programmes in agriculture, veterinary medicine, and environmental science. It has strong ties to California's agricultural and food industries.",0.46
University of Toronto,Canada,21,13,Computer Science|Engineering|Medicine|Business|Law|Economics|Arts|Social Science|Data Science|Architecture|Environmental|Education|Finance|Mathematics|Public Health,40000,16000,https://logo.clearbit.com/utoronto.ca,https://www.utoronto.ca,7.5,6.5,100,False,University of Toronto Fellowship,2,The University of Toronto is Canada's top university and a world leader in research and innovation. It is consistently ranked among the global top 25 and excels across every academic discipline.,0.43
University of British Columbia,Canada,38,24,Computer Science|Engineering|Medicine|Business|Law|Economics|Arts|Social Science|Data Science|Architecture|Environmental|Education|Finance|Forestry|Nursing,36000,18000,https://logo.clearbit.com/ubc.ca,https://www.ubc.ca,7.5,6.5,100,False,UBC International Leader of Tomorrow Award,2,"The University of British Columbia is Canada's second-ranked university and a globally recognised research institution. Located in Vancouver, it is known for its stunning campus, diverse community, and strength in science and sustainability.",0.52
McGill University,Canada,46,28,Computer Science|Engineering|Medicine|Business|Law|Economics|Arts|Social Science|Data Science|Architecture|Environmental|Music|Dentistry|Nursing,28000,16000,https://logo.clearbit.com/mcgill.ca,https://www.mcgill.ca,7.5,6.5,100,False,McGill Scholarship and Student Aid,2,"McGill University is Canada's most internationally recognised university, with a bilingual campus in Montreal. It is known for its rigorous academic standards and has produced the most Nobel laureates of any Canadian institution.",0.46
University of Waterloo,Canada,149,72,Computer Science|Engineering|Mathematics|Business|Economics|Environmental|Data Science|Quantum Computing|Architecture|Arts|Science,36000,14000,https://logo.clearbit.com/uwaterloo.ca,https://www.uwaterloo.ca,7.5,7.0,100,True,Waterloo Graduate Scholarship,2,"The University of Waterloo is Canada's top engineering and technology university, renowned for the world's largest post-secondary cooperative education programme. It is considered Canada's MIT and has strong ties to Silicon Valley.",0.53
McMaster University,Canada,176,82,Engineering|Computer Science|Medicine|Business|Economics|Arts|Social Science|Data Science|Environmental|Health Sciences|Nursing|Mathematics,32000,14000,https://logo.clearbit.com/mcmaster.ca,https://www.mcmaster.ca,7.0,6.5,88,False,McMaster Graduate Scholarship,2,"McMaster University in Hamilton, Ontario, is a leading research-intensive university with a particular strength in health sciences, engineering, and business. It pioneered problem-based learning in medical education.",0.6
Queen's University,Canada,209,90,Engineering|Computer Science|Business|Economics|Law|Arts|Social Science|Data Science|Environmental|Health Sciences|Education|Mathematics|Finance,38000,14000,https://logo.clearbit.com/queensu.ca,https://www.queensu.ca,7.5,7.0,100,False,Queen's University Awards,2,"Queen's University in Kingston, Ontario, is one of Canada's most respected universities, known for its collegiate atmosphere and excellence in business, engineering, and the social sciences. Its Smith School of Business is highly regarded.",0.42
Western University,Canada,258,105,Computer Science|Engineering|Business|Medicine|Law|Economics|Arts|Social Science|Data Science|Education|Dentistry|Nursing|Finance,30000,14000,https://logo.clearbit.com/uwo.ca,https://www.uwo.ca,7.0,6.5,88,False,Western Graduate Research Scholarship,2,"Western University in London, Ontario, is a leading Canadian research university known for its Ivey Business School, medical school, and strong campus community. It provides an exceptional student experience in a mid-sized city.",0.58
University of Calgary,Canada,242,103,Engineering|Computer Science|Business|Medicine|Law|Economics|Arts|Social Science|Data Science|Environmental|Education|Nursing|Finance|Architecture,28000,14000,https://logo.clearbit.com/ucalgary.ca,https://www.ucalgary.ca,7.0,6.5,88,False,Graduate Award Competition,2,"The University of Calgary is a leading Canadian research university located in the heart of Calgary's growing energy and technology sector. It excels in engineering, business, medicine, and environmental studies.",0.6
University of Alberta,Canada,111,64,Engineering|Computer Science|Business|Medicine|Law|Economics|Arts|Social Science|Data Science|Environmental|Agriculture|Nursing|Education|Pharmacy,28000,14000,https://logo.clearbit.com/ualberta.ca,https://www.ualberta.ca,7.0,6.5,88,False,Alberta Graduate Excellence Scholarship,2,"The University of Alberta is one of Canada's top research universities, consistently ranked in the global top 150. It is a flagship institution for engineering, computing, and oil-sands research.",0.58
Dalhousie University,Canada,298,115,Engineering|Computer Science|Business|Medicine|Law|Economics|Arts|Social Science|Data Science|Environmental|Agriculture|Nursing|Architecture|Dentistry,24000,14000,https://logo.clearbit.com/dal.ca,https://www.dal.ca,7.0,6.5,88,False,Dalhousie International Scholarship,2,"Dalhousie University in Halifax, Nova Scotia, is one of Canada's leading research universities with a beautiful coastal setting. It has particular strengths in ocean sciences, medicine, and engineering.",0.65
Simon Fraser University,Canada,339,126,Computer Science|Engineering|Business|Economics|Arts|Social Science|Data Science|Environmental|Education|Mathematics|Science,22000,18000,https://logo.clearbit.com/sfu.ca,https://www.sfu.ca,7.0,6.5,88,False,SFU Graduate Scholarship,2,"Simon Fraser University in Burnaby, British Columbia, is a leading Canadian research university known for its innovative programmes in computing, engineering, and the social sciences. Its campuses in metropolitan Vancouver provide excellent career opportunities.",0.6
University of Ottawa,Canada,292,113,Computer Science|Engineering|Business|Law|Economics|Arts|Social Science|Data Science|Environmental|Medicine|Education|Nursing|Public Health,26000,15000,https://logo.clearbit.com/uottawa.ca,https://www.uottawa.ca,7.0,6.5,88,False,Excellence Scholarship,2,"The University of Ottawa is Canada's largest bilingual university, situated in the heart of the nation's capital. It excels in law, social sciences, and health sciences, with strong connections to the federal government.",0.63
Australian National University,Australia,30,19,Computer Science|Engineering|Medicine|Business|Law|Economics|Arts|Social Science|Data Science|Environmental|Public Policy|Mathematics|Physics,42000,18000,https://logo.clearbit.com/anu.edu.au,https://www.anu.edu.au,7.5,7.0,100,False,ANU Chancellor's International Scholarship,2,"ANU is Australia's top-ranked university and a world leader in research and policy, located in the national capital Canberra. It excels in the social sciences, science, and public policy.",0.35
University of Melbourne,Australia,14,9,Computer Science|Engineering|Medicine|Business|Law|Economics|Arts|Social Science|Data Science|Architecture|Environmental|Education|Veterinary|Dentistry|Finance,40000,20000,https://logo.clearbit.com/unimelb.edu.au,https://www.unimelb.edu.au,7.5,7.0,100,False,Melbourne International Undergraduate Scholarship,2,"The University of Melbourne is Australia's second-ranked university and a member of the Group of Eight, known for its research excellence and comprehensive range of programmes. It is the highest ranked university in the southern hemisphere.",0.7
University of Sydney,Australia,18,11,Computer Science|Engineering|Medicine|Business|Law|Economics|Arts|Social Science|Data Science|Architecture|Environmental|Education|Veterinary|Dentistry|Nursing,42000,20000,https://logo.clearbit.com/sydney.edu.au,https://www.sydney.edu.au,7.5,7.0,100,False,Sydney Scholars Award,2,"The University of Sydney is Australia's oldest university, founded in 1850, and a member of the prestigious Group of Eight. It is consistently ranked among the world's top 20 universities.",0.3
UNSW Sydney,Australia,19,12,Computer Science|Engineering|Medicine|Business|Law|Economics|Arts|Social Science|Data Science|Architecture|Environmental|Education|Finance|Mathematics,42000,20000,https://logo.clearbit.com/unsw.edu.au,https://www.unsw.edu.au,7.5,7.0,100,False,UNSW Scientia Scholarship,2,"UNSW Sydney is a member of the Group of Eight and a world leader in engineering, business, and law. It is located in the vibrant coastal city of Sydney and has strong connections with industry and government.",0.36
