name,country,ranking,qs_subject_ranking,subject,tuition,living_cost,image_url,website,requirements_cgpa,ielts,toefl,gre_required,scholarships,course_duration,description,acceptance_rate
University of Oxford,United Kingdom,3,1,Computer Science|Mathematics|Physics|Economics|Law|Medicine|Engineering|Philosophy|History|Social Science|Public Health|Environmental|Arts|Business|Data Science,35000,18000,https://logo.clearbit.com/ox.ac.uk,https://www.ox.ac.uk,8.0,7.5,110,False,Rhodes Scholarship,1,"The University of Oxford is one of the world's oldest and most prestigious universities, consistently ranked in the global top 5. It offers world-class teaching and research across virtually every academic discipline.",0.17
University of Cambridge,United Kingdom,2,2,Computer Science|Mathematics|Physics|Economics|Engineering|Law|Medicine|Architecture|Social Science|Environmental|Arts|History|Philosophy|Data Science,35000,18000,https://logo.clearbit.com/cam.ac.uk,https://www.cam.ac.uk,8.0,7.5,110,False,Cambridge Trust Scholarship,1,The University of Cambridge is a world-leading research university with a rich 800-year history. Its collegiate system and rigorous academic culture have produced over 100 Nobel laureates.,0.21
Imperial College London,United Kingdom,6,3,Computer Science|Engineering|Physics|Mathematics|Medicine|Data Science|Environmental|Business|Bioengineering|Chemical Engineering,36000,18000,https://logo.clearbit.com/imperial.ac.uk,https://www.imperial.ac.uk,7.5,7.0,100,False,President's PhD Scholarship,1,"Imperial College London is a science-focused university in the heart of London, renowned for its engineering, medicine, and natural sciences programmes. It is consistently ranked among the world's top 10 universities.",0.14
University College London,United Kingdom,9,8,Computer Science|Engineering|Economics|Law|Medicine|Architecture|Arts|Social Science|Public Health|Environmental|Data Science|Mathematics|Business,30000,18000,https://logo.clearbit.com/ucl.ac.uk,https://www.ucl.ac.uk,7.5,7.0,100,False,UCL Global Masters Scholarship,1,"UCL is London's leading multidisciplinary university, with more than 16,000 staff and 50,000 students from 150 countries. It is known for its commitment to research, innovation and global impact.",0.63
London School of Economics,United Kingdom,45,5,Economics|Finance|Business|Law|Social Science|Public Health|Data Science|Political Science|International Relations|Sociology|Management,28000,18000,https://logo.clearbit.com/lse.ac.uk,https://www.lse.ac.uk,7.5,7.0,107,False,LSE Postgraduate Support Scheme,1,"The London School of Economics and Political Science is a world-leading social science university, specialising in economics, finance, law, and the social and political sciences. LSE's alumni include heads of state, Nobel laureates, and business leaders.",0.16
King's College London,United Kingdom,40,22,Law|Medicine|Engineering|Business|Social Science|Arts|Public Health|Nursing|Computer Science|Mathematics|Economics|International Relations,28000,18000,https://logo.clearbit.com/kcl.ac.uk,https://www.kcl.ac.uk,7.0,7.0,100,False,King's India Scholarship,1,"King's College London is one of the UK's oldest and most prestigious universities, with a strong reputation in law, medicine, and the humanities. Situated in the centre of London, it offers students a vibrant academic and cultural experience.",0.28
University of Edinburgh,United Kingdom,22,15,Computer Science|Engineering|Medicine|Law|Business|Economics|Arts|Social Science|Mathematics|Data Science|Environmental|Architecture|Philosophy,28000,15000,https://logo.clearbit.com/ed.ac.uk,https://www.ed.ac.uk,7.0,6.5,92,False,Edinburgh Global Online Learning Scholarship,1,"The University of Edinburgh is one of the UK's oldest and most prestigious universities, founded in 1583. It is a global research leader and a top destination for students in arts, medicine, and technology.",0.43
University of Manchester,United Kingdom,32,20,Computer Science|Engineering|Business|Economics|Medicine|Physics|Mathematics|Law|Social Science|Data Science|Arts|Environmental|Architecture,26000,14000,https://logo.clearbit.com/manchester.ac.uk,https://www.manchester.ac.uk,7.0,6.5,90,False,President's Doctoral Scholar Award,1,"The University of Manchester is a major research university and member of the prestigious Russell Group. It is home to a vibrant student community and has strong connections with industry, making it ideal for career-focused study.",0.54
University of Bristol,United Kingdom,55,30,Computer Science|Engineering|Economics|Law|Medicine|Arts|Social Science|Mathematics|Physics|Environmental|Architecture|Data Science|Business,25000,15000,https://logo.clearbit.com/bristol.ac.uk,https://www.bristol.ac.uk,7.0,6.5,90,False,Think Big Scholarship,1,"The University of Bristol is a leading UK research university known for its excellence in science, engineering, arts, and social sciences. It has a strong research culture and a vibrant student community.",0.61
University of Warwick,United Kingdom,69,35,Computer Science|Economics|Business|Engineering|Mathematics|Law|Arts|Social Science|Finance|Data Science|Physics|Statistics,27000,14000,https://logo.clearbit.com/warwick.ac.uk,https://www.warwick.ac.uk,7.5,6.5,92,False,Warwick Chancellors International Scholarship,1,"The University of Warwick is a leading UK research university renowned for its strengths in business, economics, engineering, and the sciences. It consistently ranks among the top universities in the UK and globally.",0.78
Durham University,United Kingdom,92,55,Computer Science|Engineering|Business|Economics|Law|Arts|Social Science|Mathematics|Physics|Finance|Environmental|Medicine|Archaeology,25000,13000,https://logo.clearbit.com/durham.ac.uk,https://www.durham.ac.uk,7.0,6.5,90,False,Durham Global Support Scholarship,1,"Durham University is one of the UK's most prestigious universities, known for its collegiate system and strong academic tradition. It excels in the arts and humanities, sciences, and social sciences.",0.66
University of Bath,United Kingdom,158,70,Engineering|Business|Computer Science|Mathematics|Economics|Social Science|Architecture|Data Science|Chemistry|Physics,25000,14000,https://logo.clearbit.com/bath.ac.uk,https://www.bath.ac.uk,7.0,6.5,90,False,,1,"The University of Bath is consistently ranked among the top universities in the UK and is renowned for its excellence in engineering, science, and management. Its strong industry links provide excellent graduate employment prospects.",0.72
University of Birmingham,United Kingdom,84,50,Computer Science|Engineering|Business|Economics|Law|Medicine|Arts|Social Science|Mathematics|Environmental|Finance|Architecture|Data Science,24000,13000,https://logo.clearbit.com/birmingham.ac.uk,https://www.birmingham.ac.uk,7.0,6.5,88,False,Global Excellence Scholarship,1,"The University of Birmingham is a leading UK research university and member of the Russell Group. It is known for its strength in engineering, business, and medicine, and its global research partnerships.",0.66
University of Nottingham,United Kingdom,99,60,Computer Science|Engineering|Business|Economics|Medicine|Law|Arts|Social Science|Mathematics|Environmental|Data Science|Finance|Architecture|Pharmacy,23000,12000,https://logo.clearbit.com/nottingham.ac.uk,https://www.nottingham.ac.uk,7.0,6.5,88,False,Nottingham Global Impact Scholarship,1,The University of Nottingham is a Russell Group university with a strong international presence and campuses in Malaysia and China. It is known for its research excellence and innovation-friendly environment.,0.69
University of Leeds,United Kingdom,86,45,Computer Science|Engineering|Business|Economics|Law|Medicine|Arts|Social Science|Mathematics|Environmental|Data Science|Architecture|Education|Finance,23000,13000,https://logo.clearbit.com/leeds.ac.uk,https://www.leeds.ac.uk,7.0,6.5,88,False,Leeds International Scholarship,1,"The University of Leeds is a leading UK research university and Russell Group member, known for its excellence in engineering, business, medicine, and the arts. It is one of the UK's largest universities with a vibrant student community.",0.69
University of Sheffield,United Kingdom,105,65,Computer Science|Engineering|Business|Economics|Medicine|Law|Arts|Social Science|Mathematics|Environmental|Architecture|Data Science|Finance,23000,13000,https://logo.clearbit.com/sheffield.ac.uk,https://www.sheffield.ac.uk,7.0,6.5,88,False,Sheffield Merit Scholarship,1,"The University of Sheffield is a Russell Group university widely recognised for research excellence in engineering, science, and medicine. It has a strong student satisfaction record and excellent graduate employment outcomes.",0.72
University of Glasgow,United Kingdom,73,42,Computer Science|Engineering|Business|Economics|Medicine|Law|Arts|Social Science|Mathematics|Environmental|Data Science|Architecture|Veterinary,24000,13000,https://logo.clearbit.com/gla.ac.uk,https://www.gla.ac.uk,7.0,6.5,90,False,Glasgow Caledonian Scholarship,1,"The University of Glasgow is one of the UK's oldest universities and a member of the Russell Group. It is renowned for research excellence in medicine, science, engineering, and the arts.",0.74
University of St Andrews,United Kingdom,100,58,Computer Science|Mathematics|Physics|Economics|Arts|Social Science|History|Philosophy|Environmental|Medicine|Law|International Relations,26000,13000,https://logo.clearbit.com/st-andrews.ac.uk,https://www.st-andrews.ac.uk,7.5,7.0,100,False,St Andrews Scholarship,1,"The University of St Andrews is Scotland's oldest university and one of the most ancient in the English-speaking world. It is celebrated for its academic excellence, historic campus, and strong student community.",0.3
University of Exeter,United Kingdom,153,75,Computer Science|Engineering|Business|Economics|Law|Arts|Social Science|Mathematics|Environmental|Data Science|Finance|Education|Biosciences,23000,13000,https://logo.clearbit.com/exeter.ac.uk,https://www.exeter.ac.uk,7.0,6.5,88,False,Global Excellence Scholarship,1,"The University of Exeter is a research-intensive university in the Russell Group, known for its beautiful campuses and strengths in sustainability, business, and the humanities. It ranks highly for student satisfaction.",0.7
University of Southampton,United Kingdom,81,48,Computer Science|Engineering|Business|Economics|Medicine|Law|Arts|Social Science|Mathematics|Environmental|Data Science|Oceanography|Architecture|Finance,24000,13000,https://logo.clearbit.com/southampton.ac.uk,https://www.southampton.ac.uk,7.0,6.5,88,False,Southampton Excellence Scholarship,1,"The University of Southampton is a leading UK research university and a member of the Russell Group, with particular strengths in engineering, electronics, oceanography, and medicine. It is home to world-class research facilities.",0.68
University of York,United Kingdom,175,80,Computer Science|Business|Economics|Arts|Social Science|Mathematics|Environmental|Law|Health Sciences|Education|History|Philosophy|Data Science,22000,13000,https://logo.clearbit.com/york.ac.uk,https://www.york.ac.uk,7.0,6.5,88,False,,1,"The University of York is a Russell Group university known for its teaching quality, research impact, and beautiful campus. It has particular strengths in health sciences, social sciences, arts, and computer science.",0.74
Queen Mary University of London,United Kingdom,150,72,Computer Science|Engineering|Business|Economics|Law|Medicine|Arts|Social Science|Mathematics|Environmental|Data Science|Finance,24000,18000,https://logo.clearbit.com/qmul.ac.uk,https://www.qmul.ac.uk,7.0,6.5,90,False,Principal's Postgraduate Research Scholarship,1,"Queen Mary University of London is a leading UK research university and member of the Russell Group. Based in vibrant East London, it is known for its strength in medicine, law, engineering, and the humanities.",0.71
Lancaster University,United Kingdom,163,78,Computer Science|Business|Economics|Arts|Social Science|Mathematics|Environmental|Law|Management|Finance|Data Science,21000,12000,https://logo.clearbit.com/lancaster.ac.uk,https://www.lancaster.ac.uk,7.0,6.5,88,False,Lancaster Global Scholarship,1,"Lancaster University is a highly ranked UK university known for its collegiate campus environment and research excellence in business, management, and the social sciences. It consistently scores highly in national teaching quality surveys.",0.69
University of Liverpool,United Kingdom,176,82,Computer Science|Engineering|Business|Economics|Law|Medicine|Arts|Social Science|Mathematics|Environmental|Architecture|Data Science|Finance,22000,13000,https://logo.clearbit.com/liverpool.ac.uk,https://www.liverpool.ac.uk,7.0,6.5,88,False,,1,"The University of Liverpool is a Russell Group research university with strong programmes in engineering, science, medicine, and the arts. Its vibrant city campus offers an outstanding student experience.",0.72
Newcastle University,United Kingdom,178,84,Computer Science|Engineering|Business|Economics|Law|Medicine|Arts|Social Science|Mathematics|Environmental|Architecture|Data Science|Finance,23000,13000,https://logo.clearbit.com/ncl.ac.uk,https://www.ncl.ac.uk,7.0,6.5,88,False,,1,"Newcastle University is a Russell Group institution known for its research excellence in engineering, medicine, and the arts. It is located in one of the UK's most vibrant and affordable student cities.",0.72
Cardiff University,United Kingdom,183,88,Computer Science|Engineering|Business|Economics|Law|Medicine|Arts|Social Science|Mathematics|Environmental|Architecture|Data Science|Finance|Pharmacy,22000,12000,https://logo.clearbit.com/cardiff.ac.uk,https://www.cardiff.ac.uk,7.0,6.5,88,False,,1,"Cardiff University is Wales's leading research university and a member of the Russell Group, known for its vibrant capital city campus and strengths in medicine, engineering, and the social sciences.",0.73
Loughborough University,United Kingdom,222,95,Engineering|Business|Computer Science|Mathematics|Social Science|Sports Science|Architecture|Data Science|Economics|Design,22000,12000,https://logo.clearbit.com/lboro.ac.uk,https://www.lboro.ac.uk,7.0,6.5,88,False,,1,"Loughborough University is a leading UK university renowned for engineering, design, and sports science. It consistently tops rankings for student experience and graduate employability.",0.74
University of Aberdeen,United Kingdom,238,100,Computer Science|Engineering|Business|Economics|Law|Medicine|Arts|Social Science|Mathematics|Environmental|Energy|Data Science,20000,12000,https://logo.clearbit.com/abdn.ac.uk,https://www.abdn.ac.uk,7.0,6.5,88,False,,1,"The University of Aberdeen is one of the UK's oldest universities, founded in 1495, with particular strengths in energy, medicine, and the physical sciences. It offers a friendly campus environment in one of Scotland's most vibrant cities.",0.78
Heriot-Watt University,United Kingdom,354,115,Engineering|Computer Science|Business|Mathematics|Environmental|Architecture|Data Science|Economics|Energy|Finance,20000,13000,https://logo.clearbit.com/hw.ac.uk,https://www.hw.ac.uk,7.0,6.5,88,False,,1,"Heriot-Watt University is a specialist institution with a strong focus on science, engineering, and business. It has campuses in Edinburgh, Dubai, and Malaysia, making it a truly global university.",0.75
University of Reading,United Kingdom,278,108,Business|Economics|Law|Arts|Social Science|Environmental|Agriculture|Computer Science|Data Science|Mathematics|Education|Finance,22000,14000,https://logo.clearbit.com/reading.ac.uk,https://www.reading.ac.uk,7.0,6.5,88,False,,1,"The University of Reading is a research-intensive university known for its strengths in meteorology, agriculture, business, and the arts. It has a beautiful campus and strong links to industry.",0.76
University of Leicester,United Kingdom,296,112,Computer Science|Engineering|Business|Economics|Law|Medicine|Arts|Social Science|Mathematics|Data Science|Finance|Archaeology|Space Science,22000,12000,https://logo.clearbit.com/le.ac.uk,https://www.le.ac.uk,7.0,6.5,88,False,,1,"The University of Leicester is a research-led university known for pioneering discoveries in genetics, space science, and medieval history. It has a strong focus on widening participation and student wellbeing.",0.76
University of Sussex,United Kingdom,327,120,Computer Science|Business|Economics|Law|Arts|Social Science|Environmental|Mathematics|Data Science|Education|Psychology|Finance,22000,15000,https://logo.clearbit.com/sussex.ac.uk,https://www.sussex.ac.uk,7.0,6.5,88,False,,1,"The University of Sussex is a research university in Brighton, known for its progressive values and strengths in social sciences, arts, and environmental studies. It has a beautiful campus close to the South Downs.",0.76
University of Stirling,United Kingdom,401,135,Business|Economics|Law|Arts|Social Science|Environmental|Computer Science|Data Science|Finance|Education|Nursing,20000,12000,https://logo.clearbit.com/stir.ac.uk,https://www.stir.ac.uk,7.0,6.5,85,False,,1,"The University of Stirling is a campus university in Scotland known for its strengths in sports science, business, and social sciences. It has a picturesque loch-side campus and a strong research profile.",0.78
Coventry University,United Kingdom,601,180,Engineering|Business|Computer Science|Arts|Social Science|Economics|Law|Data Science|Architecture|Finance|Design,18000,12000,https://logo.clearbit.com/coventry.ac.uk,https://www.coventry.ac.uk,6.5,6.0,85,False,,1,"Coventry University is a dynamic, modern university in the Midlands known for its strong industry connections and career-focused programmes. It is one of the most popular destinations for international students in the UK.",0.85
Aston University,United Kingdom,551,165,Engineering|Business|Computer Science|Mathematics|Economics|Law|Data Science|Pharmacy|Social Science|Finance|Optometry,22000,12000,https://logo.clearbit.com/aston.ac.uk,https://www.aston.ac.uk,7.0,6.5,88,False,,1,"Aston University is a leading university in Birmingham known for its focus on business, engineering, and health sciences. It has strong ties to industry and an impressive graduate employment record.",0.76
City University of London,United Kingdom,533,160,Business|Economics|Law|Computer Science|Engineering|Finance|Social Science|Data Science|Arts|Journalism|Optometry,24000,18000,https://logo.clearbit.com/city.ac.uk,https://www.city.ac.uk,7.0,6.5,90,False,,1,"City, University of London is a leading global university committed to academic excellence and practical impact. It is particularly known for its programmes in law, business, finance, and journalism.",0.78
Brunel University London,United Kingdom,596,178,Engineering|Computer Science|Business|Economics|Arts|Social Science|Law|Design|Data Science|Mathematics|Finance,21000,18000,https://logo.clearbit.com/brunel.ac.uk,https://www.brunel.ac.uk,7.0,6.0,85,False,,1,Brunel University London is a research university in West London known for its applied research and strong connections to industry and government. It offers an excellent student experience with a focus on employability.,0.78
University of Surrey,United Kingdom,435,140,Engineering|Computer Science|Business|Economics|Arts|Social Science|Environmental|Data Science|Mathematics|Finance|Veterinary,24000,15000,https://logo.clearbit.com/surrey.ac.uk,https://www.surrey.ac.uk,7.0,6.5,88,False,,1,"The University of Surrey is a leading research university in Guildford, known for its strengths in engineering, business, and the life sciences. It has a beautiful campus and a strong graduate employment record.",0.73
Massachusetts Institute of Technology,United States,1,1,Computer Science|Engineering|Physics|Mathematics|Data Science|Business|Architecture|Economics|Chemistry|Bioengineering|Aerospace|Mechanical Engineering,59000,22000,https://logo.clearbit.com/mit.edu,https://www.mit.edu,9.0,7.5,100,True,MIT Fellowship,2,"MIT is the world's foremost science and technology university, consistently ranked #1 globally. Its cutting-edge research and innovation culture have produced 98 Nobel laureates and countless transformative technologies.",0.04
Stanford University,United States,5,4,Computer Science|Engineering|Business|Medicine|Law|Economics|Education|Environmental|Data Science|Physics|Mathematics|Social Science,58000,22000,https://logo.clearbit.com/stanford.edu,https://www.stanford.edu,9.0,7.5,100,True,Stanford Fellowship,2,"Stanford University is a world-leading research university at the heart of Silicon Valley, renowned for innovation, entrepreneurship, and excellence across engineering, business, and the humanities.",0.04
Harvard University,United States,4,3,Computer Science|Engineering|Business|Medicine|Law|Economics|Education|Environmental|Data Science|Physics|Mathematics|Social Science|Public Health|Arts|History,55000,22000,https://logo.clearbit.com/harvard.edu,https://www.harvard.edu,9.0,7.5,100,False,Harvard Financial Aid,2,"Harvard University is one of the world's most iconic and prestigious institutions, with strengths across every academic discipline from law and medicine to science and the humanities. Its global alumni network is unparalleled.",0.03
California Institute of Technology,United States,6,2,Computer Science|Engineering|Physics|Mathematics|Data Science|Chemistry|Astronomy|Bioengineering|Aerospace,60000,22000,https://logo.clearbit.com/caltech.edu,https://www.caltech.edu,9.0,7.5,100,True,Caltech Fellowship,2,"Caltech is a world-renowned science and engineering institution in Pasadena, California. With one of the highest faculty-to-student ratios in the world, it offers an incredibly intense and rewarding academic experience.",0.04
Yale University,United States,16,10,Computer Science|Engineering|Business|Medicine|Law|Economics|Education|Environmental|Arts|History|Philosophy|Social Science|Architecture|Data Science,64000,22000,https://logo.clearbit.com/yale.edu,https://www.yale.edu,9.0,7.5,100,False,Yale Graduate Fellowship,2,"Yale University is one of the Ivy League's most celebrated institutions, known for its outstanding programmes in law, medicine, arts, and the humanities. It combines rigorous scholarship with a vibrant cultural life.",0.05
Princeton University,United States,17,11,Computer Science|Engineering|Physics|Mathematics|Economics|Social Science|Arts|History|Philosophy|Data Science|Environmental|Public Policy,58000,22000,https://logo.clearbit.com/princeton.edu,https://www.princeton.edu,9.0,7.5,100,True,Princeton Graduate Fellowship,2,"Princeton University is an Ivy League institution renowned for its undergraduate focus, world-class research, and famous alumni in politics, business, and the sciences. It consistently ranks among the world's top universities.",0.04
Columbia University,United States,22,14,Computer Science|Engineering|Business|Medicine|Law|Economics|Education|Environmental|Arts|History|Philosophy|Social Science|Architecture|Data Science|Public Health|Journalism,67000,22000,https://logo.clearbit.com/columbia.edu,https://www.columbia.edu,8.5,7.0,100,True,Columbia University Fellowship,2,"Columbia University is an Ivy League research university in New York City, offering a uniquely urban and cosmopolitan academic environment. It excels in journalism, law, business, and the sciences.",0.05
Cornell University,United States,20,12,Computer Science|Engineering|Business|Medicine|Law|Economics|Architecture|Environmental|Arts|Social Science|Data Science|Agriculture|Hotel Management,61000,22000,https://logo.clearbit.com/cornell.edu,https://www.cornell.edu,8.5,7.0,100,True,Cornell Graduate Fellowship,2,"Cornell University is an Ivy League research university in Ithaca, New York, known for its diverse range of programmes and research excellence. It is one of the few Ivy League universities with a college of engineering.",0.1
University of Chicago,United States,11,7,Computer Science|Economics|Business|Law|Social Science|Arts|History|Philosophy|Mathematics|Data Science|Public Policy|Physics,61000,22000,https://logo.clearbit.com/uchicago.edu,https://www.uchicago.edu,8.5,7.0,102,False,UChicago Merit Award,2,"The University of Chicago is a world-renowned research university known for its rigorous academic culture and pioneering work in economics, law, and the social sciences. It has been home to 100 Nobel laureates.",0.06
University of Pennsylvania,United States,12,8,Computer Science|Engineering|Business|Medicine|Law|Economics|Social Science|Arts|Architecture|Data Science|Nursing|Education|Finance,62000,22000,https://logo.clearbit.com/upenn.edu,https://www.upenn.edu,8.5,7.0,100,True,Penn Provost Fellowship,2,"The University of Pennsylvania is an Ivy League institution in Philadelphia, home to the Wharton School, one of the world's top business schools. It excels in medicine, law, business, and engineering.",0.07
Duke University,United States,67,38,Computer Science|Engineering|Business|Medicine|Law|Economics|Environmental|Arts|Social Science|Data Science|Public Policy|Mathematics,62000,22000,https://logo.clearbit.com/duke.edu,https://www.duke.edu,8.5,7.0,100,False,Duke Graduate Fellowship,2,"Duke University is a leading research university in Durham, North Carolina, known for its excellence in medicine, law, business, and environmental science. It combines a vibrant campus life with rigorous academic standards.",0.08
Johns Hopkins University,United States,31,18,Medicine|Public Health|Engineering|Computer Science|Social Science|Arts|Economics|Data Science|Environmental|Bioengineering|Nursing|International Studies,60000,22000,https://logo.clearbit.com/jhu.edu,https://www.jhu.edu,8.5,7.0,100,True,JHU Graduate Fellowship,2,"Johns Hopkins University is a world-leader in medicine, public health, and engineering research. It is renowned for producing pioneering research and fostering a culture of discovery and scientific inquiry.",0.11
